gid,title,content,judge,reason,category,status,error
7605861711350901651,贞贞姐口播探讨婚姻与归属，对比不同生活状态下的情感需求,视频中作者贞贞姐身穿红色上衣，以室内为背景进行口播，围绕婚车渐远的现象展开，探讨当下人们对婚姻的不同选择；先阐述不结婚的年轻时光的自由，又描述长期单身可能面临的孤独无依，同时说明婚姻与家庭带来的烟火气与情感联结；最后指出关键不在结不结婚，而在建立深刻情感连接，找到归属，愿人们清醒勇敢，在自由与深情间平衡。视频无明显引导、宣传、擦边或卖点表达。,无法基于现有信息完成UGC原创分享类（正式/前置）正式质量审核判断,对照前置锚点要求，完全缺失/错位的关键锚点项有：①全程使用第三人称“贞贞姐”“作者贞贞姐”概括原创主体，无第一人称专属标识及图文场景专属创作细节，原创身份痕迹完全缺失；②明确为非图文类的“口播视频”，发布品类锚点完全错位；③仅关联非目标品类载体的内容，发布意图/核心场景锚点非图文适配；④仅提供他人对视频本体的第三方概括性转述，未提供UGC原创图文类目标发布本体的任何有效信息。上述全部关键锚点缺失或错位，导致后续属性适配性、原创价值密度、预设目标受众期待满足度、完整合规边界识别等核心正式审核模块均无有效依据。,审核素材完全错位,completed,
7617800229077152187,作者分享甲减致变丑及体重难控困扰，求问甲减瘦身方法,这条抖音图文笔记中，作者以文字结合带有同款文案的猫咪表情包，呈现了自己认为甲减会让人变丑、体重难以控制的困扰，同时向有经验的人求助甲减瘦下去的方法，无明显引导、宣传、擦边或卖点表达。,无法基于现有信息完成UGC原创分享类（正式/前置）正式质量审核判断,对照前置锚点要求，本次提交的内容完全不符合有效审核素材的要求：1. **明确原创身份痕迹完全缺失**：全程使用第三人称“作者”“这条抖音图文笔记”概括原创主体及载体，无第一人称专属标识、无图文场景专属的创作细节暗示；2. **待审核内容本体关键信息完全无效**：仅提供他人对该本体的第三方概括性转述，完全无原创者视角产出的待发布/已发布UGC本体的自身信息片段（如标题原文、全文文案、逐张图片的文字化专属内容等）。以上缺失导致属性适配性、原创价值密度、预设目标受众期待满足度、完整合规边界识别等核心正式审核模块均无有效依据。,审核素材无效,completed,
7609325286547327907,作者记录老婆分娩过程并表达对老婆的心疼与爱意,这条内容以图片帖的形式，呈现了作者在医院等待老婆分娩时拍摄的产房状态屏幕、刚出生的婴儿照片，搭配文案记录等待过程、心疼老婆分娩的辛苦并表达爱意，无明显引导、宣传或擦边内容。,无法基于现有信息完成UGC原创分享类（正式/前置）正式质量审核判断,对照前置锚点要求，完全缺失/无效的关键锚点项如下：,审核素材无效,completed,
7604918710541622117,作者着苗族盛装在贵州山寨景点拍摄46张旅游照，主打入乡随俗,这条抖音是作者发布的46张图片集，展示自己身着红色苗族盛装、佩戴银饰头饰，在贵州的苗族山寨景点（包括吊脚楼、湖水、山地建筑等场景）的留影，还有与同行亲友的合照。整体记录旅游体验，文案强调“入乡随俗”的拍照风格，无明显引导、宣传或擦边内容。,无法基于现有信息完成UGC原创分享类（正式/前置）正式质量审核判断,对照强制前置流程验证锚点要求，存在以下完全无效或关键锚点缺失项：1. 全程使用第三人称“作者”“这条抖音”概括原创主体与疑似关联载体，无第一人称专属标识、无图文场景专属的真实创作细节（如“拍这套苗族盛装用了我带的三套补光灯”“文案是昨天跟寨子里阿姐聊天后改的‘阿姐教我的红配银才地道’版本”），原创身份痕迹完全缺失；2. 无待审核内容本体的强绑定图文信息（无标题原文、原创者视角产出的全文文案、逐张/分组核心图片的文字化专属标注等），仅用第三方低信息量转述替代，核心UGC原创分享内容、属性、价值均无有效依据支撑；3. 提及载体为“抖音”虽有“图片集”表述，但未明确锚定为【正式图文分享】或【图文公开预告说明】类前置/正式纯/主图文笔记，载体存在模糊混淆其他品类的风险。以上问题导致后续属性适配性、原创价值密度、预设目标受众期待满足度、完整合规边界识别等核心正式审核模块均无法开展。,审核素材无效,completed,
7624867256287107259,丹丹在寒食节于户外弹唱尤克里里《小手拉大手》记录踏青时光,视频画面展现了绿植环绕的户外场景，作者坐在石阶上弹尤克里里，配文关联寒食节与郊游踏青，弹唱曲目为梁静茹的《小手拉大手》，还穿插呈现了小孩的画面，整体氛围轻松日常，无明显引导、宣传或擦边类表达。,无法基于现有信息完成UGC原创分享类（正式/前置）正式质量审核判断,对照前置锚点要求，完全缺失/无效/错位的关键锚点项如下：,审核素材无效,completed,
7611534939964503205,用户发布图文询问常州工学院宿舍的限电瓦数,这是一条图文笔记，背景为浅米色并带有新年快乐的小字与装饰，中间用橙色圆形衬托的文字写着“常州工学院宿舍限电多少瓦”，下方有一个带问号的卡通小马图案。作者通过文案和图片内容向网友询问该问题，带有“不懂就问万能网友”的话题引导互动，无明显宣传或擦边等表达。,无法基于现有信息完成UGC原创分享类（正式/前置）正式质量审核判断,对照前置锚点要求，关键锚点1、3、4均完全缺失/无效，后续属性适配性、原创价值密度等核心正式审核模块均无有效依据，具体：,审核素材无效,completed,
7579205962260858041,小白呀发布含4张户外人像照的图片帖，表达风格可模仿但感觉难复刻的观点,这条抖音图片帖由作者“小白呀”发布，包含4张户外场景下的人像照片，展示了不同的拍照姿势；文案传递“拍照风格可以模仿，但照片里的感觉难以复刻”的个人感受；带有摄影、拍照姿势类话题，属于真实生活分享内容，无明显引导、宣传、擦边或卖点表达。,无法基于现有信息完成UGC原创分享类（正式/前置）正式质量审核判断,对照前置锚点要求，本次待验证信息存在以下**全关键锚点缺失或无效/错位风险**：,审核素材无效,completed,
